{
  "schema": "aiops.bootstrap_options.v1",
  "version": "1",
  "generated_from": [
    "bootstrap/bootstrap_reference.md",
    "bootstrap/project_bootstrap_policy.md",
    "schemas/operating_model.schema.json"
  ],
  "categories": {
    "bootstrap_mode": {
      "label": "Bootstrap Mode",
      "question": "How much setup guidance should AI Ops use before applying project files?",
      "default": "fast_track",
      "option_source": "bootstrap/bootstrap_reference.md",
      "record_to": ".ai_project/operating_model.md:bootstrap_mode",
      "options": [
        {
          "id": "fast_track",
          "label": "Fast Track",
          "description": "Use a short question flow and minimal safe defaults.",
          "changes": "Creates a lighter .ai_project shape and leaves advanced choices deferred.",
          "recommended_when": "New users, small projects, idea discovery, or solo work.",
          "risk": "Some team, branch, and workflow details may need expansion later."
        },
        {
          "id": "guided_full",
          "label": "Guided Full",
          "description": "Compare team, role, workflow, ownership, board, and branch options step by step.",
          "changes": "Creates the fuller .ai_project shape with detailed operating decisions.",
          "recommended_when": "Code projects, multiple agents, PR flows, or multi-team setup.",
          "risk": "Heavier initial setup."
        },
        {
          "id": "manual",
          "label": "Manual",
          "description": "Use custom project decisions without the standard guided flow.",
          "changes": "Requires the operator to keep required fields coherent.",
          "recommended_when": "Existing organizations with their own process.",
          "risk": "Higher chance of missing required AI Ops fields."
        },
        {
          "id": "migrated",
          "label": "Migrated",
          "description": "Mark a project that was created or upgraded through migration.",
          "changes": "Preserves existing project decisions and records migration provenance.",
          "recommended_when": "Existing .ai_project setups upgraded from an older AI Ops version.",
          "risk": "May need migration validation before strict operation."
        }
      ]
    },
    "start_context": {
      "label": "Start Context",
      "question": "What kind of project start is this?",
      "default": null,
      "option_source": "bootstrap/bootstrap_reference.md",
      "record_to": ".ai_project/operating_model.md:start_context",
      "options": [
        {
          "id": "new_project_with_requirement",
          "label": "New project with requirement",
          "description": "A new project or business starts from an idea, requirement, or rough plan.",
          "changes": "Readiness is checked before implementation roles are activated.",
          "recommended_when": "The user knows what they want to build at least roughly.",
          "activates_roles": [
            "Direction Role",
            "Lead Role",
            "Ops Governance Role"
          ]
        },
        {
          "id": "assigned_or_existing_project",
          "label": "Assigned or existing project",
          "description": "AI Ops is being applied to an existing repository, task, or handoff.",
          "changes": "Project scan and source-of-truth verification come first.",
          "recommended_when": "There is existing code, documentation, or company work to take over.",
          "activates_roles": [
            "Lead Role",
            "Verification Role",
            "Ops Governance Role"
          ]
        },
        {
          "id": "blank_slate_discovery",
          "label": "Blank slate discovery",
          "description": "The user does not know what to build yet and wants to explore from zero.",
          "changes": "No product task is created until Direction work produces a candidate direction.",
          "recommended_when": "Idea discovery, research, or problem finding.",
          "activates_roles": [
            "Direction Role",
            "Ops Governance Role"
          ]
        },
        {
          "id": "rescue_or_recovery",
          "label": "Rescue or recovery",
          "description": "The project needs stabilization before normal planning or implementation.",
          "changes": "Build, test, missing context, and broken process checks are prioritized.",
          "recommended_when": "Broken builds, missing documentation, abandoned work, or failed handoff.",
          "activates_roles": [
            "Lead Role",
            "Verification Role",
            "Ops Governance Role"
          ]
        },
        {
          "id": "migration_or_modernization",
          "label": "Migration or modernization",
          "description": "The main goal is to move or modernize an existing system.",
          "changes": "Scope, compatibility, rollback, and verification gates become primary.",
          "recommended_when": "Framework upgrades, architecture migration, repo restructuring.",
          "activates_roles": [
            "Lead Role",
            "Execution Role",
            "Verification Role",
            "Ops Governance Role"
          ]
        },
        {
          "id": "ops_setup_only",
          "label": "Ops setup only",
          "description": "The user only wants AI Ops operating files, not product work.",
          "changes": "Creates operating setup and defers product tasks.",
          "recommended_when": "Installing AI Ops into a project before actual work starts.",
          "activates_roles": [
            "Ops Governance Role"
          ]
        },
        {
          "id": "scale_up_existing_ops",
          "label": "Scale up existing ops",
          "description": "An existing AI Ops setup needs more teams, roles, or stricter workflow.",
          "changes": "Current .ai_project decisions are reviewed before expansion.",
          "recommended_when": "A solo or small setup is growing into team operation.",
          "activates_roles": [
            "Lead Role",
            "Ops Governance Role"
          ]
        },
        {
          "id": "custom_start_context",
          "label": "Custom",
          "description": "The start context does not fit the standard options.",
          "changes": "The user must record a custom summary and required decisions.",
          "recommended_when": "Special operating environments or mixed project contexts.",
          "risk": "Requires more explicit decision records."
        }
      ]
    },
    "readiness_level": {
      "label": "Readiness Level",
      "question": "How ready is the project for execution?",
      "default": null,
      "option_source": "bootstrap/bootstrap_reference.md",
      "record_to": ".ai_project/operating_model.md:readiness_level",
      "options": [
        {
          "id": "idea_only",
          "label": "Idea only",
          "description": "The idea is still vague or only stated in a sentence.",
          "changes": "Implementation is deferred and Direction work comes first.",
          "recommended_when": "The user needs to clarify problem, audience, and value."
        },
        {
          "id": "idea_structured",
          "label": "Idea structured",
          "description": "The goal and core features are roughly understood.",
          "changes": "Product direction and MVP scope can be drafted before execution.",
          "recommended_when": "The user can describe what the product should do."
        },
        {
          "id": "planning_ready",
          "label": "Planning ready",
          "description": "Planning exists, but implementation breakdown is not ready.",
          "changes": "Task breakdown, source of truth, and verification criteria are prepared.",
          "recommended_when": "Requirements exist but work items and tests are not clear."
        },
        {
          "id": "implementation_ready",
          "label": "Implementation ready",
          "description": "Requirements and acceptance criteria are ready enough to build.",
          "changes": "Execution and Verification roles can be activated.",
          "recommended_when": "The first approved task can be created safely."
        },
        {
          "id": "existing_project_scan_required",
          "label": "Existing project scan required",
          "description": "Existing files must be scanned before decisions are trusted.",
          "changes": "Source-of-truth and code/document consistency are checked first.",
          "recommended_when": "AI Ops is being applied to an existing repo."
        },
        {
          "id": "discovery_required",
          "label": "Discovery required",
          "description": "The problem, user, or value is not clear enough yet.",
          "changes": "Discovery tasks and Direction questions come before build tasks.",
          "recommended_when": "The user is exploring possibilities."
        },
        {
          "id": "recovery_required",
          "label": "Recovery required",
          "description": "The project must be stabilized before normal execution.",
          "changes": "Recovery tasks and verification criteria take priority.",
          "recommended_when": "Build, test, dependency, or documentation state is unreliable."
        },
        {
          "id": "ops_only",
          "label": "Ops only",
          "description": "Only the AI Ops operating setup is needed now.",
          "changes": "Product direction and implementation tasks remain unresolved.",
          "recommended_when": "The project is only installing or reviewing the harness."
        }
      ]
    },
    "operating_mode": {
      "label": "Operating Mode",
      "question": "How much operating structure does this project need?",
      "default": "solo_light",
      "option_source": "bootstrap/bootstrap_reference.md",
      "record_to": ".ai_project/operating_model.md:operating_mode",
      "options": [
        {